Question,Answers,Correct Answer,Answer Letter,Open Ended Answer
What is the primary use of remote sensing in soil moisture measurement?,"A) To analyze soil color and structure, B) To provide large-scale soil moisture data without extensive fieldwork, C) To measure soil temperature variations",Answer: B) To provide large-scale soil moisture data without extensive fieldwork.,B,
What is the process referred to as when water flows from the ground into a channelized stream?,"A) Evaporation, B) Runoff, C) Transpiration",Answer: B) Runoff,B,
Which term describes the volume of water flowing in a stream over a specified time?,"A) Infiltration, B) Discharge, C) Baseflow",Answer: B) Discharge,B,
What graphical representation shows the variation of streamflow over time?,"A) Temperature graph, B) Hydrograph, C) Bar chart",Answer: B) Hydrograph,B,
What term refers to the initial steep part of a hydrograph leading up to the peak flow?,"A) Recession limb, B) Rising limb, C) Baseflow",Answer: B) Rising limb,B,
What type of flow occurs when water moves across the surface of the land?,"A) Subsurface flow, B) Groundwater flow, C) Overland flow",Answer: C) Overland flow,C,
Which mechanism of runoff generation is characterized by water moving through saturated soil?,"A) Hortonian overland flow, B) Saturated overland flow, C) Interflow",Answer: B) Saturated overland flow,B,
What concept describes the areas in a catchment that contribute overland flow to a storm hydrograph?,"A) Constant source areas, B) Variable source areas, C) Fixed source areas",Answer: B) Variable source areas,B,
The process of water moving through the unsaturated zone after infiltrating the soil is known as what?,"A) Groundwater flow, B) Throughflow, C) Overland flow",Answer: B) Throughflow,B,
What is the primary source of baseflow in a river system?,"A) Surface runoff, B) Groundwater, C) Channel precipitation",Answer: B) Groundwater,B,
Which factor significantly influences the shape of a hydrograph during a storm?,"A) Wind speed, B) Vegetation type, C) Temperature",Answer: B) Vegetation type,B,
"What type of flooding occurs rapidly due to intense rainfall, often overwhelming drainage systems?","A) River flooding, B) Flash flooding, C) Coastal flooding",Answer: B) Flash flooding,B,
Which phenomenon can cause increased flooding due to changes in precipitation patterns associated with climate shifts?,"A) Urbanization, B) Deforestation, C) Climate change",Answer: C) Climate change,C,
What term describes the effect of urbanization on flood magnitude and frequency?,"A) Decreased runoff, B) Increased runoff, C) Stabilized runoff",Answer: B) Increased runoff,B,
Which theory suggests that rapid water movement occurs as newly infiltrated water pushes older water down a soil column?,"A) Piston flow, B) Saturated overland flow, C) Lateral flow",Answer: A) Piston flow,A,
What is the role of macropores in hydrology?,"A) To slow down water movement, B) To facilitate rapid water movement, C) To store groundwater",Answer: B) To facilitate rapid water movement,B,
What is the primary cause of river floods?,"A) Excessive soil moisture, B) Too much rainfall, C) High evaporation rates",Answer: B) Too much rainfall,B,
Which type of flow is characterized by water that has been in the soil for an extended time before entering a stream?,"A) New water, B) Old water, C) Surface runoff",Answer: B) Old water,B,
What is the primary difference between stormflow and baseflow?,"A) Stormflow is rapid, while baseflow is slow and sustained., B) Stormflow occurs only in summer, while baseflow occurs in winter., C) Stormflow comes from surface runoff, while baseflow comes from precipitation.","Answer: A) Stormflow is rapid, while baseflow is slow and sustained.",A,
What hydrological process involves the drainage of water from saturated ground to a stream?,"A) Surface runoff, B) Subsurface flow, C) Groundwater discharge",Answer: C) Groundwater discharge,C,
What is the fundamental purpose of hydrometry?,"A) To study the chemical composition of water, B) To measure the volume of water flowing in a stream, C) To analyze the ecological impact of rivers",Answer: B) To measure the volume of water flowing in a stream,B,
Which two main techniques are used for streamflow measurement?,"A) Surface and subsurface measurements, B) Instantaneous and continuous techniques, C) Manual and automated methods",Answer: B) Instantaneous and continuous techniques,B,
What unit is typically used to express stream discharge?,"A) Liters per minute, B) Cubic meters per second (m3/s), C) Gallons per hour",Answer: B) Cubic meters per second (m3/s),B,
What is the velocity–area method primarily used for in hydrometry?,"A) Estimating water quality, B) Measuring stream velocity and cross-sectional area, C) Analyzing sediment transport",Answer: B) Measuring stream velocity and cross-sectional area,B,
What is necessary to ensure accurate streamflow measurements using the velocity–area method?,"A) A perfectly still surface, B) A representative sampling strategy, C) High water temperatures",Answer: B) A representative sampling strategy,B,
What is the purpose of a current meter in streamflow measurement?,"A) To measure water temperature, B) To record the depth of the riverbed, C) To measure the velocity of water flow",Answer: C) To measure the velocity of water flow,C,
What is a common challenge faced when measuring stream velocity with a current meter?,"A) Measuring the water's temperature, B) Ensuring the meter is not influenced by surface waves, C) Avoiding interference from aquatic life",Answer: B) Ensuring the meter is not influenced by surface waves,B,
How does the International Standard ISO 748:2007 contribute to streamflow measurement?,"A) It provides guidelines for data analysis, B) It sets the standards for measurement techniques, C) It outlines the ecological impacts of streamflow",Answer: B) It sets the standards for measurement techniques,B,
What is a rating curve in the context of streamflow measurement?,"A) A graph showing the relationship between water temperature and flow, B) A relationship between river stage and discharge, C) A chart indicating sediment levels in a river",Answer: B) A relationship between river stage and discharge,B,
Why might a rating curve need to be adjusted over time?,"A) Due to seasonal changes in temperature, B) Because of changes in the riverbed profile, C) To reflect changes in local precipitation",Answer: B) Because of changes in the riverbed profile,B,
What is one advantage of using electromagnetic current meters over mechanical meters?,"A) They are less expensive, B) They do not have moving parts that can obstruct flow, C) They are easier to operate",Answer: B) They do not have moving parts that can obstruct flow,B,
What principle does ultrasonic flow measurement rely on?,"A) The buoyancy of water, B) The difference in transit time of ultrasonic pulses, C) The temperature of the stream",Answer: B) The difference in transit time of ultrasonic pulses,B,
What is the primary function of a stilling well in streamflow measurement?,"A) To provide a habitat for aquatic life, B) To measure the temperature of the water, C) To facilitate continuous measurement of river stage",Answer: C) To facilitate continuous measurement of river stage,C,
What can dilution gauging help estimate in a river?,"A) The water quality, B) The volume of pollutants, C) The streamflow rate",Answer: C) The streamflow rate,C,
Why is the stage-discharge relationship important for hydrologists?,"A) It helps predict weather patterns, B) It allows for continuous measurement of discharge from stage height, C) It determines sediment transport rates",Answer: B) It allows for continuous measurement of discharge from stage height,B,
In what scenario might the use of a gas bubbler be preferred for measuring stage height?,"A) In fast-flowing rivers, B) In areas prone to flooding, C) In locations where traditional equipment is vulnerable",Answer: C) In locations where traditional equipment is vulnerable,C,
What is a common issue when gauging flow in gravel-bed rivers?,"A) The water temperature fluctuates greatly, B) The riverbed profile changes frequently, C) There are too few measurement points",Answer: B) The riverbed profile changes frequently,B,
What type of current meter is particularly suited for measuring flow in very large rivers?,"A) Mechanical current meters, B) Small handheld meters, C) Boat-mounted ADCP instruments",Answer: C) Boat-mounted ADCP instruments,C,
Which equation is used to calculate stream velocity using the Manning roughness coefficient?,"A) Q = A × v, B) v = k × R^(2/3) × s^(1/2), C) Q = g × h^(3/2)",Answer: B) v = k × R^(2/3) × s^(1/2),B,
What is the primary purpose of analyzing streamflow data in hydrology?,"A) To measure the temperature of water bodies, B) To analyze the effects of pollution on aquatic life, C) To describe flow regimes and predict future river flows",Answer: C) To describe flow regimes and predict future river flows,C,
What is a hydrograph?,"A) A graph showing the chemical composition of river water, B) A continuous record of stream or river discharge over time, C) A method for measuring water quality in streams",Answer: B) A continuous record of stream or river discharge over time,B,
Which method is commonly used to separate stormflow from baseflow in a hydrograph?,"A) Frequency analysis, B) Hydrograph separation, C) Flow duration curves",Answer: B) Hydrograph separation,B,
What does the unit hydrograph represent in hydrology?,"A) The total volume of water in a river basin, B) The hydrograph of surface runoff resulting from effective rainfall in a specific time unit, C) The average temperature of water over a given period",Answer: B) The hydrograph of surface runoff resulting from effective rainfall in a specific time unit,B,
What is a flow duration curve?,"A) A graph showing the minimum flow levels of a river, B) A plot showing the frequency of river flows over time, C) A representation of the percentage of time that a flow is equaled or exceeded",Answer: C) A representation of the percentage of time that a flow is equaled or exceeded,C,
What is the significance of effective rainfall in hydrology?,"A) It includes all rainfall that contributes to surface runoff, B) It refers to the total rainfall received in a catchment area, C) It is the amount of rainfall that evaporates before reaching the ground",Answer: A) It includes all rainfall that contributes to surface runoff,A,
Why is hydrograph analysis important in understanding river systems?,"A) It allows for the measurement of water temperature, B) It provides insights into the response of a catchment to unique conditions, C) It helps in the chemical analysis of water samples",Answer: B) It provides insights into the response of a catchment to unique conditions,B,
What does frequency analysis in hydrology primarily focus on?,"A) The average flow of rivers over time, B) The probability of specific flow events occurring, C) The chemical quality of water in streams",Answer: B) The probability of specific flow events occurring,B,
What is a key limitation of the unit hydrograph approach?,"A) It requires extensive historical data, B) It assumes rainfall is uniform across the catchment, C) It does not account for human activities in the catchment",Answer: B) It assumes rainfall is uniform across the catchment,B,
How is the annual probability of flooding expressed in hydrology?,"A) As a percentage, B) As a total volume of water, C) As a frequency count of flood events",Answer: A) As a percentage,A,
Which of the following is a common method for flood frequency analysis?,"A) Using daily mean flows, B) Using hourly temperature readings, C) Using sediment transport measurements",Answer: A) Using daily mean flows,A,
What is the purpose of constructing a flow duration curve?,"A) To determine the chemical composition of stream water, B) To analyze the frequency of different flow levels, C) To estimate the average temperature of river water",Answer: B) To analyze the frequency of different flow levels,B,
What assumption is made when using the unit hydrograph method?,"A) The relationship between effective rainfall and surface runoff varies over time, B) Effective rainfall is equal to the water equivalent depth of storm runoff, C) All rainfall events are independent of each other",Answer: B) Effective rainfall is equal to the water equivalent depth of storm runoff,B,
What type of model is the Curve Number (CN) approach considered?,"A) A physically based hydrological model, B) An empirical, black-box model, C) A statistical regression model","Answer: B) An empirical, black-box model",B,
"In the context of hydrological modeling, what does a 'black box' model imply?","A) The model accounts for all physical processes in detail, B) The processes are simplified and not visible from the outside, C) The model is based solely on historical data",Answer: B) The processes are simplified and not visible from the outside,B,
What does the historical flow method in instream flow assessment focus on?,"A) Predicting future flow regimes based on current data, B) Setting water abstraction limits based on historical flow ranges, C) Measuring the ecological impact of specific flow levels",Answer: B) Setting water abstraction limits based on historical flow ranges,B,
What does the hydraulic method in flow assessment measure?,"A) The impacts of land use on water quality, B) The relationship between hydraulic parameters and stream health, C) The temperature gradients in a river system",Answer: B) The relationship between hydraulic parameters and stream health,B,
Which of the following factors can greatly affect the runoff from a catchment?,"A) The color of the soil, B) Vegetation cover and land use changes, C) The presence of fish species in the water",Answer: B) Vegetation cover and land use changes,B,
What are the primary sources of pollutants in aquatic environments?,"A) Natural weathering and volcanic activity, B) Fossil fuel combustion and agricultural runoff, C) Industrial noise and light pollution",Answer: B) Fossil fuel combustion and agricultural runoff,B,
How is water quality commonly measured in rivers?,"A) Through visual inspection alone, B) By assessing physical and chemical parameters, C) Using only temperature readings",Answer: B) By assessing physical and chemical parameters,B,
What is the significance of dissolved oxygen in aquatic ecosystems?,"A) It is a measure of temperature changes, B) It is essential for the respiration of aquatic organisms, C) It indicates the presence of heavy metals",Answer: B) It is essential for the respiration of aquatic organisms,B,
Which of the following is a common method for treating wastewater?,"A) Sedimentation and filtration, B) Boiling and cooling, C) Freezing and thawing",Answer: A) Sedimentation and filtration,A,
What does eutrophication refer to in aquatic systems?,"A) The depletion of oxygen levels, B) The increase in nutrient levels leading to excessive plant growth, C) The introduction of toxic pollutants",Answer: B) The increase in nutrient levels leading to excessive plant growth,B,
Which environmental factor can greatly influence water quality in a river?,"A) Urban development and population density, B) The color of the riverbed, C) The size of the fish present",Answer: A) Urban development and population density,A,
What is the impact of suspended solids in river water?,"A) They enhance the clarity of the water, B) They can obstruct the spawning of aquatic organisms, C) They have no effect on water quality",Answer: B) They can obstruct the spawning of aquatic organisms,B,
What is the role of the Hjulstrom curve in hydrology?,"A) It describes the effects of temperature on water quality, B) It relates stream velocity to sediment transport and deposition, C) It measures the toxicity of pollutants in water",Answer: B) It relates stream velocity to sediment transport and deposition,B,
What are trace organics in the context of water quality?,"A) Compounds that have no significant health effects, B) Organic compounds that are present in very low concentrations but can be harmful, C) Substances that enhance plant growth in water",Answer: B) Organic compounds that are present in very low concentrations but can be harmful,B,
Which parameter is critical for assessing the health of aquatic ecosystems?,"A) The color of the water, B) The presence of dissolved oxygen, C) The sound levels in the environment",Answer: B) The presence of dissolved oxygen,B,
How does temperature affect the dissolved oxygen content in water?,"A) Higher temperatures increase dissolved oxygen levels, B) Lower temperatures decrease dissolved oxygen levels, C) Higher temperatures decrease dissolved oxygen levels",Answer: C) Higher temperatures decrease dissolved oxygen levels,C,
What is the primary concern with nitrogen compounds in freshwater systems?,"A) They are harmless and naturally occurring, B) They can lead to cultural eutrophication and water quality issues, C) They only affect marine ecosystems",Answer: B) They can lead to cultural eutrophication and water quality issues,B,
What is the purpose of using biological indicators in water quality assessment?,"A) To measure nutrient concentrations, B) To evaluate the health of aquatic fauna in relation to water quality, C) To determine the temperature of the water",Answer: B) To evaluate the health of aquatic fauna in relation to water quality,B,
"In terms of water quality, what is the significance of biochemical oxygen demand (BOD)?","A) It measures the temperature of the water, B) It indicates the amount of organic matter present in water, C) It assesses the visual clarity of the water",Answer: B) It indicates the amount of organic matter present in water,B,
Which of the following is a potential outcome of high levels of phosphates in water?,"A) Decreased water temperature, B) Increased algal blooms and potentially harmful effects on aquatic life, C) Improved water clarity",Answer: B) Increased algal blooms and potentially harmful effects on aquatic life,B,
What is meant by point source pollution?,"A) Pollution that comes from diffuse sources across a large area, B) Pollution that originates from a single, identifiable source, C) Pollution that is gradually absorbed by the soil","Answer: B) Pollution that originates from a single, identifiable source",B,
What effect does heavy metal contamination have on aquatic ecosystems?,"A) It improves the growth of aquatic plants, B) It can be toxic to aquatic organisms even at low concentrations, C) It has no effect on aquatic life",Answer: B) It can be toxic to aquatic organisms even at low concentrations,B,
How can stormwater runoff be managed to reduce its impact on water quality?,"A) By allowing it to flow directly into rivers, B) By capturing and treating it before it enters water bodies, C) By increasing urban development in the area",Answer: B) By capturing and treating it before it enters water bodies,B,
Why is the management of water quality important for reservoirs?,"A) To ensure they are visually appealing, B) To maintain their capacity and prevent sedimentation, C) To control fishing activities",Answer: B) To maintain their capacity and prevent sedimentation,B,
What is the primary principle behind the theory of evolution related to species survival?,"A) Species remain static over time., B) Species adapt to their ecosystems through natural selection., C) Species become less diverse over time.",Answer: B) Species adapt to their ecosystems through natural selection.,B,
How is hydrology expected to change by the end of the twenty-first century?,"A) It will become a completely different science., B) The fundamental processes will remain the same, but rates may vary., C) It will cease to be relevant to human life.","Answer: B) The fundamental processes will remain the same, but rates may vary.",B,
What does the principle of uniformitarianism suggest about the relationship between the present and past?,"A) The past has no relevance to current processes., B) The present provides insights into historical events., C) Past events are completely unrelated to current observations.",Answer: B) The present provides insights into historical events.,B,
What is an important aspect of water resource management?,"A) It focuses solely on economic returns from water resources., B) It must consider sustainability and future generations., C) It disregards the impact of human activities.",Answer: B) It must consider sustainability and future generations.,B,
Which leisure activities are mentioned as requiring clean waterways?,"A) Swimming and surfing, B) Fishing, canoeing, and boating, C) Hiking and camping","Answer: B) Fishing, canoeing, and boating.",B,
Why is land use change significant for water resource management?,"A) It has no impact on water quality., B) It can greatly affect water availability and quality., C) It only affects urban areas.",Answer: B) It can greatly affect water availability and quality.,B,
What is a key component in understanding future changes in hydrology?,"A) Predicting exact outcomes without uncertainty., B) Recognizing the role of change and uncertainty., C) Assuming historical patterns will continue indefinitely.",Answer: B) Recognizing the role of change and uncertainty.,B,
What is the relationship between human intervention and hydrological processes?,"A) Humans have no ability to influence hydrological processes., B) Almost all processes can be manipulated in some way., C) Hydrological processes operate independently from human actions.",Answer: B) Almost all processes can be manipulated in some way.,B,
How does climate change affect water resource management?,"A) It has no significant effects on water resources., B) It alters patterns of water consumption and availability., C) It only affects rural areas.",Answer: B) It alters patterns of water consumption and availability.,B,
What should be a consideration in water resource management regarding future generations?,"A) Only current economic needs should be prioritized., B) The protection of the water environment is essential., C) Future generations will not have different needs.",Answer: B) The protection of the water environment is essential.,B,
What are some issues of change that might be expected in relation to water resources?,"A) Static water consumption patterns, B) Increasing population pressure and climate change, C) Decreasing interest in hydrology",Answer: B) Increasing population pressure and climate change.,B,
"What does the term ""water resource management"" imply?","A) It only refers to water consumption for human needs., B) It involves a broader understanding of the hydrological cycle., C) It is solely concerned with recreational water use.",Answer: B) It involves a broader understanding of the hydrological cycle.,B,
"What is meant by ""amenity value"" in the context of water resources?","A) The economic profit generated by water bodies., B) The recreational and aesthetic benefits provided by rivers and lakes., C) The industrial uses of water resources.",Answer: B) The recreational and aesthetic benefits provided by rivers and lakes.,B,
How do changing views on water management impact resource management practices?,"A) They have no effect on management practices., B) They require adaptation to new societal needs and environmental challenges., C) They only focus on historical practices.",Answer: B) They require adaptation to new societal needs and environmental challenges.,B,
What role does legislative framework play in water resource management?,"A) It is irrelevant to the management process., B) It facilitates necessary consultations among stakeholders., C) It complicates the management of water resources.",Answer: B) It facilitates necessary consultations among stakeholders.,B,
What major concern does urban hydrology address?,"A) The decline of rural waterways, B) The challenges posed by increasing urban populations, C) The preservation of historical water bodies",Answer: B) The challenges posed by increasing urban populations.,B,
How does the manipulation of the hydrological cycle relate to water management?,"A) It is prohibited by environmental laws., B) It can be strategically used to address water scarcity., C) It leads to the deterioration of water quality.",Answer: B) It can be strategically used to address water scarcity.,B,
What is a fundamental belief regarding hydrological processes?,"A) They are subject to complete human control., B) They will remain consistent despite changes in the environment., C) They can change over time due to various factors.",Answer: C) They can change over time due to various factors.,C,
What is essential for successful water resource management?,"A) Ignoring the needs of other species., B) Comprehensive understanding of the hydrological cycle and its changes., C) Focusing only on immediate water needs.",Answer: B) Comprehensive understanding of the hydrological cycle and its changes.,B,
