Question,Answers,Correct Answer,Answer Letter,Open Ended Answer
What is hydrology primarily concerned with?,"A) The study of ocean currents, B) The distribution and movement of fresh water on Earth, C) The chemical composition of seawater",Answer: B) The distribution and movement of fresh water on Earth,B,
Why is water considered essential for sustaining life?,"A) It can be easily synthesized in laboratories, B) It is the only substance that can exist in three states, C) It is vital for the survival of plants and animals",Answer: C) It is vital for the survival of plants and animals,C,
What is the significance of water's high specific heat capacity?,"A) It allows water to freeze quickly, B) It helps regulate climate by absorbing and releasing energy slowly, C) It causes water to evaporate rapidly",Answer: B) It helps regulate climate by absorbing and releasing energy slowly,B,
Which of the following properties of water allows it to dissolve many substances?,"A) Low viscosity, B) Polarity, C) High density",Answer: B) Polarity,B,
What is a catchment or river basin defined as?,"A) The area where all water flows towards a river, B) An area with high rainfall, C) A region solely defined by its geological features",Answer: A) The area where all water flows towards a river,A,
What does the water balance equation represent?,"A) The flow of water only above the surface, B) A mathematical description of hydrological processes, C) The average temperature of water bodies",Answer: B) A mathematical description of hydrological processes,B,
How does the presence of ice on water bodies benefit aquatic life?,"A) Ice forms at the bottom of water bodies, B) Ice prevents evaporation of water, C) Ice provides insulation, allowing aquatic life to survive beneath","Answer: C) Ice provides insulation, allowing aquatic life to survive beneath",C,
Which process is not part of the hydrological cycle?,"A) Sublimation, B) Condensation, C) Photosynthesis",Answer: C) Photosynthesis,C,
What leads to thermal stratification in still water bodies?,"A) The freezing of water from the bottom up, B) The maximum density of water occurring at around 4 °C, C) The evaporation of surface water",Answer: B) The maximum density of water occurring at around 4 °C,B,
What is the primary source of energy transport in the global hydrological cycle?,"A) Precipitation, B) Groundwater flow, C) Evaporation",Answer: C) Evaporation,C,
How does human interaction impact hydrology?,"A) It only affects the qualitative aspects of water, B) It influences both water quantity and quality, C) It has no impact on hydrological studies",Answer: B) It influences both water quantity and quality,B,
What is ecohydrology?,"A) The study of water in relation to urban development, B) The study of hydrology in relation to ecosystems, C) The study of groundwater contamination",Answer: B) The study of hydrology in relation to ecosystems,B,
"What is meant by the term ""metastable water""?","A) Water that is always in a gaseous state, B) Water that exists in an unstable state at certain temperatures, C) Water that can only exist as ice",Answer: B) Water that exists in an unstable state at certain temperatures,B,
Why is the distribution of freshwater resources misleading when considering population needs?,"A) Freshwater is more abundant than saltwater, B) Population density varies greatly across different regions, C) Freshwater is only found in certain climates",Answer: B) Population density varies greatly across different regions,B,
What is the relationship between magnitude and frequency in hydrology?,"A) High-magnitude events occur frequently, B) Low-magnitude events are rare, C) High-magnitude events occur infrequently",Answer: C) High-magnitude events occur infrequently,C,
What effect does water vapor have in the atmosphere?,"A) It cools the earth's surface, B) It acts as a powerful greenhouse gas, C) It has no impact on climate",Answer: B) It acts as a powerful greenhouse gas,B,
"How is the term ""recurrence interval"" used in hydrology?","A) To describe the average time between events of the same magnitude, B) To indicate the maximum flow in a river, C) To determine the specific heat capacity of water",Answer: A) To describe the average time between events of the same magnitude,A,
What role does water play in energy generation in some regions?,"A) It is used solely for irrigation, B) It is harnessed in hydro-electric schemes, C) It is only used for drinking water",Answer: B) It is harnessed in hydro-electric schemes,B,
What is one characteristic of all hydrological processes?,"A) They are always predictable, B) They vary over time and space, C) They only occur in rural areas",Answer: B) They vary over time and space,B,
What is the primary form of water released from the atmosphere to the earth's surface?,"A) Water vapour, B) Precipitation, C) Evaporation",Answer: B) Precipitation,B,
Which type of cloud is primarily composed of ice particles?,"A) Warm clouds, B) Cold clouds, C) Mixed clouds",Answer: B) Cold clouds,B,
"What phenomenon occurs when warm, moist air is cooled, leading to condensation?","A) Adiabatic cooling, B) Frontal precipitation, C) Orographic lifting",Answer: A) Adiabatic cooling,A,
What are the tiny particles in the atmosphere that provide a surface for water vapour to condense?,"A) Ice crystals, B) Condensation nuclei, C) Water droplets",Answer: B) Condensation nuclei,B,
Which process describes the growth of cloud droplets through collision and coalescence?,"A) Bergeron-Findeisen process, B) Adiabatic cooling, C) Collision-coalescence process",Answer: C) Collision-coalescence process,C,
What is the term for the temperature at which water vapour begins to condense into liquid water?,"A) Dew point temperature, B) Boiling point temperature, C) Frost point temperature",Answer: A) Dew point temperature,A,
How does atmospheric pressure change with altitude?,"A) It increases, B) It remains constant, C) It decreases",Answer: C) It decreases,C,
What is a common method for measuring precipitation?,"A) Anemometer, B) Rain gauge, C) Barometer",Answer: B) Rain gauge,B,
Which type of precipitation occurs when liquid water droplets freeze upon contact with a surface?,"A) Sleet, B) Hail, C) Drizzle",Answer: A) Sleet,A,
What effect can mountains have on precipitation distribution in an area?,"A) Increase rainfall on both sides, B) Create a rain shadow effect, C) Have no significant impact",Answer: B) Create a rain shadow effect,B,
What is the main purpose of cloud seeding?,"A) To measure atmospheric pressure, B) To enhance precipitation, C) To reduce evaporation",Answer: B) To enhance precipitation,B,
Which factor primarily influences the ability of air to hold water vapour?,"A) Humidity, B) Pressure, C) Temperature",Answer: C) Temperature,C,
What is the typical lapse rate for dry air as it rises in the atmosphere?,"A) 6 °C per km, B) 9.8 °C per km, C) 4.5 °C per km",Answer: B) 9.8 °C per km,B,
What is the main challenge associated with measuring precipitation accurately?,"A) Limited technology, B) Spatial variability, C) High cost of equipment",Answer: B) Spatial variability,B,
During which condition can supercooled water droplets exist without freezing?,"A) In warm clouds, B) In cold clouds, C) In mixed clouds",Answer: A) In warm clouds,A,
What occurs when air rises and expands in the atmosphere?,"A) It warms up, B) It cools down, C) It becomes saturated",Answer: B) It cools down,B,
What is the primary cause of variations in precipitation distribution globally?,"A) Static influences, B) Dynamic influences, C) Geographical features",Answer: B) Dynamic influences,B,
Which instrument measures the rate of evaporation in a catchment area?,"A) Rain gauge, B) Evaporimeter, C) Anemometer",Answer: B) Evaporimeter,B,
What is the term for the alternating layers of clear and opaque ice found in hailstones?,"A) Stratification, B) Aggregation, C) Layering",Answer: C) Layering,C,
What is the primary use of GIS in hydrology?,"A) To measure temperature, B) To analyze precipitation distribution, C) To assess soil moisture",Answer: B) To analyze precipitation distribution,B,
What is the process by which liquid water transforms into a gaseous state and diffuses into the atmosphere?,"A) Condensation, B) Evaporation, C) Precipitation",Answer: B) Evaporation,B,
Which two factors are crucial for the process of evaporation to occur?,"A) Temperature and humidity, B) Water presence and energy availability, C) Wind speed and atmospheric pressure",Answer: B) Water presence and energy availability,B,
What term describes evaporation that occurs above a body of water such as a lake or ocean?,"A) Actual evaporation, B) Potential evaporation, C) Open water evaporation",Answer: C) Open water evaporation,C,
How does actual evaporation differ from potential evaporation?,"A) Actual evaporation is always greater than potential evaporation, B) Actual evaporation occurs under limited water supply conditions, C) Actual evaporation is the maximum possible evaporation rate",Answer: B) Actual evaporation occurs under limited water supply conditions,B,
What is the primary factor that can limit evaporation in arid climates?,"A) High humidity, B) Low wind speeds, C) Scarcity of liquid water",Answer: C) Scarcity of liquid water,C,
What is the primary energy source for evaporation?,"A) Geothermal energy, B) Solar energy, C) Wind energy",Answer: B) Solar energy,B,
Which measurement technique is commonly used for estimating evaporation losses from open water bodies?,"A) Precipitation gauges, B) Evaporation pans, C) Soil moisture probes",Answer: B) Evaporation pans,B,
What is the role of stomata in the process of transpiration?,"A) They absorb water from the soil, B) They regulate water vapor release from leaves, C) They increase soil moisture",Answer: B) They regulate water vapor release from leaves,B,
"What does the term ""vapor pressure deficit"" refer to?","A) The pressure of water vapor in the atmosphere, B) The difference between actual and saturated vapor pressure, C) The total amount of water vapor present in the air",Answer: B) The difference between actual and saturated vapor pressure,B,
How does wind speed affect the rate of evaporation?,"A) It has no effect on evaporation, B) Higher wind speeds can enhance evaporation by moving air away from the surface, C) Lower wind speeds increase evaporation rates",Answer: B) Higher wind speeds can enhance evaporation by moving air away from the surface,B,
In what scenario would evaporation from a vegetation canopy be most significant?,"A) During rainy weather, B) In arid climates, C) In tropical rainforests",Answer: C) In tropical rainforests,C,
What is the relationship between temperature and the ability of the air to hold water vapor?,"A) Higher temperatures decrease the air's capacity for water vapor, B) Higher temperatures increase the air's capacity for water vapor, C) Temperature has no effect on water vapor capacity",Answer: B) Higher temperatures increase the air's capacity for water vapor,B,
Which method is an indirect way to estimate evaporation using water balance techniques?,"A) Eddy covariance method, B) Lysimeter method, C) Micro-meteorological measurement",Answer: B) Lysimeter method,B,
What is the significance of net radiation in the evaporation process?,"A) It is a minor factor, B) It is the primary source of energy for evaporation, C) It measures soil moisture content",Answer: B) It is the primary source of energy for evaporation,B,
How does salinity affect evaporation rates from water bodies?,"A) Evaporation rates increase with higher salinity, B) Evaporation rates remain unchanged regardless of salinity, C) Evaporation rates decrease with higher salinity",Answer: C) Evaporation rates decrease with higher salinity,C,
What is the primary challenge in measuring evaporation accurately?,"A) Variability of precipitation, B) Difficulty in measuring gas concentrations, C) Constant temperature changes",Answer: B) Difficulty in measuring gas concentrations,B,
What is the purpose of using reference evaporation in agricultural studies?,"A) To measure soil moisture directly, B) To standardize evaporation measurements across different crops, C) To calculate precipitation rates",Answer: B) To standardize evaporation measurements across different crops,B,
"Which type of vegetation typically exhibits substantial stomatal control, reducing transpiration rates under stress?","A) Grasses, B) Coniferous trees, C) Deciduous trees",Answer: B) Coniferous trees,B,
What is the primary function of the Bowen ratio method in evaporation estimation?,"A) To measure soil temperature, B) To compare latent and sensible heat fluxes, C) To calculate rainfall rates",Answer: B) To compare latent and sensible heat fluxes,B,
What does the water balance equation primarily account for in hydrology?,"A) The distribution of precipitation, B) The movement and storage of water, C) The chemical composition of water",Answer: B) The movement and storage of water,B,
Which of the following is a major component of the global hydrological cycle?,"A) Atmospheric pollution, B) Soil moisture, C) Urban runoff",Answer: B) Soil moisture,B,
"How is the term ""storage"" in the water balance equation best described?","A) As an absolute measure of water quantity, B) As a dynamic process involving inflow and outflow, C) As a static accumulation of water",Answer: B) As a dynamic process involving inflow and outflow,B,
What is throughfall in the context of precipitation?,"A) Water that evaporates before reaching the ground, B) Water that falls to the ground after being caught by vegetation, C) Water that runs off the land surface into rivers",Answer: B) Water that falls to the ground after being caught by vegetation,B,
Which factor significantly influences canopy storage capacity?,"A) Soil pH, B) Canopy structure and leaf characteristics, C) Groundwater levels",Answer: B) Canopy structure and leaf characteristics,B,
What does the leaf area index (LAI) measure?,"A) The total biomass of vegetation, B) The ratio of leaf area to ground surface area, C) The rate of photosynthesis in plants",Answer: B) The ratio of leaf area to ground surface area,B,
What is stemflow?,"A) Water that flows directly into rivers from rainfall, B) Water that runs down the stems and branches of plants to the ground, C) Water that evaporates from leaf surfaces",Answer: B) Water that runs down the stems and branches of plants to the ground,B,
Which of the following factors does NOT influence interception loss?,"A) Rainfall intensity, B) Soil moisture levels, C) Canopy structure",Answer: B) Soil moisture levels,B,
How does the presence of vegetation affect interception loss?,"A) It decreases interception loss significantly, B) It has no effect on interception loss, C) It increases interception loss due to wet leaf evaporation",Answer: C) It increases interception loss due to wet leaf evaporation,C,
What role does snow play in the hydrological cycle?,"A) It is a minor component of water storage, B) It can significantly impact river flows through melting, C) It is only relevant in tropical climates",Answer: B) It can significantly impact river flows through melting,B,
What is the main challenge in measuring throughfall in forested areas?,"A) Variability in rainfall intensity, B) The spatial heterogeneity of the forest canopy, C) The lack of precipitation measurement tools",Answer: B) The spatial heterogeneity of the forest canopy,B,
Which method is commonly used to estimate snow cover?,"A) Groundwater sampling, B) Satellite remote sensing, C) Soil moisture probes",Answer: B) Satellite remote sensing,B,
What can cause significant water loss in forested areas after logging?,"A) Increased precipitation, B) Changes in canopy structure and condensation nuclei, C) Improved soil quality",Answer: B) Changes in canopy structure and condensation nuclei,B,
What is depression storage in hydrology?,"A) Water stored in soil layers, B) Water that collects in flat surfaces and depressions, C) Water stored in glaciers and ice caps",Answer: B) Water that collects in flat surfaces and depressions,B,
How do remote sensing techniques contribute to hydrology?,"A) They provide real-time data on soil temperature, B) They help monitor surface water, snow, and ice, C) They measure groundwater levels directly","Answer: B) They help monitor surface water, snow, and ice",B,
Which of the following best describes sublimation in the context of snow and ice?,"A) The process of water freezing, B) The transition of water from liquid to vapor, C) The transition of water from solid to vapor",Answer: C) The transition of water from solid to vapor,C,
What is one of the primary uses of understanding the timing of snowmelt?,"A) To determine soil nutrient content, B) To forecast streamflow and water availability, C) To predict weather patterns",Answer: B) To forecast streamflow and water availability,B,
Which characteristic of trees can enhance stemflow?,"A) Leaf density, B) Bark smoothness, C) Root depth",Answer: B) Bark smoothness,B,
What is a significant effect of ice jams in river systems?,"A) Decreased evaporation rates, B) Altered sediment transport, C) Potential flooding and damage",Answer: C) Potential flooding and damage,C,
What is the vadose zone primarily composed of?,"A) Saturated water, B) Soil and air, C) Bedrock and minerals",Answer: B) Soil and air,B,
What characterizes the phreatic zone?,"A) It is always dry., B) It is located above the water table., C) It is saturated with water.",Answer: C) It is saturated with water.,C,
What is the term used for the ratio of voids to the total volume in a soil or rock?,"A) Specific yield, B) Porosity, C) Hydraulic conductivity",Answer: B) Porosity,B,
How is effective porosity defined?,"A) The total volume of voids in a material., B) The volume of interconnected pores that allow fluid flow., C) The volume of water held within a material.",Answer: B) The volume of interconnected pores that allow fluid flow.,B,
What is the primary role of hydrogeologists?,"A) To study the movement of water in the atmosphere., B) To analyze the distribution of soil types., C) To investigate groundwater and its properties.",Answer: C) To investigate groundwater and its properties.,C,
What typically influences the hydraulic conductivity of a material?,"A) The size of the solid particles., B) The amount of sunlight received., C) The temperature of the surrounding environment.",Answer: A) The size of the solid particles.,A,
What defines an unconstrained aquifer?,"A) Water is confined under pressure., B) The water table can rise and fall freely., C) It is always located beneath bedrock.",Answer: B) The water table can rise and fall freely.,B,
Which of the following describes a perched aquifer?,"A) An aquifer that is permanently saturated., B) An aquifer that is located below the regional water table., C) An aquifer that is located above the main water table due to an impermeable layer.",Answer: C) An aquifer that is located above the main water table due to an impermeable layer.,C,
What is the primary driver of groundwater flow?,"A) Temperature differences, B) Pressure gradients and elevation differences, C) Soil composition",Answer: B) Pressure gradients and elevation differences,B,
What is an artesian well?,"A) A well that is always dry., B) A well with water that rises due to pressure., C) A well that only collects rainwater.",Answer: B) A well with water that rises due to pressure.,B,
"What does the term ""specific yield"" refer to in groundwater studies?","A) The total volume of water in an aquifer., B) The amount of water that can be extracted from an aquifer., C) The water held back by capillary forces.",Answer: B) The amount of water that can be extracted from an aquifer.,B,
How is groundwater recharge defined?,"A) The process of water evaporating from the surface., B) The process by which water from precipitation infiltrates the ground., C) The process of extracting water from aquifers.",Answer: B) The process by which water from precipitation infiltrates the ground.,B,
What is the difference between an aquifer and an aquitard?,"A) An aquifer can store water, while an aquitard cannot., B) An aquifer is always located above an aquitard., C) An aquifer is a type of aquitard.","Answer: A) An aquifer can store water, while an aquitard cannot.",A,
What does the hydraulic gradient describe?,"A) The temperature difference between two points., B) The difference in elevation affecting water flow., C) The amount of water stored in an aquifer.",Answer: B) The difference in elevation affecting water flow.,B,
Which factor does NOT typically influence groundwater movement?,"A) Soil texture, B) Local climate, C) Surface vegetation type",Answer: C) Surface vegetation type,C,
What is the significance of the potentiometric surface in groundwater studies?,"A) It indicates the temperature of groundwater., B) It represents the height to which water would rise in a well., C) It measures the total volume of groundwater present.",Answer: B) It represents the height to which water would rise in a well.,B,
What is the primary purpose of piezometers in groundwater studies?,"A) To measure soil moisture content., B) To estimate the height of the water table., C) To extract groundwater for use.",Answer: B) To estimate the height of the water table.,B,
Which isotopes are commonly used to estimate the age of groundwater?,"A) Carbon-14 and Oxygen-18, B) Hydrogen-2 and Nitrogen-15, C) Helium-4 and Carbon-12",Answer: A) Carbon-14 and Oxygen-18,A,
What is the primary characteristic of the unsaturated zone in relation to water content?,"A) It is always saturated with water., B) It is typically less than saturated but can be saturated at times., C) It contains only solid particles and no water.",Answer: B) It is typically less than saturated but can be saturated at times.,B,
Which term refers to water that is held in the unsaturated zone?,"A) Groundwater, B) Soil water, C) Surface water",Answer: B) Soil water,B,
What factor significantly influences the behavior of water in soil?,"A) Air pressure, B) Grain size of soil particles, C) Color of the soil",Answer: B) Grain size of soil particles,B,
What is soil texture primarily a measure of?,"A) Color and smell of the soil, B) Grain size distribution of soil particles, C) Organic matter content in soil",Answer: B) Grain size distribution of soil particles,B,
What is the concept of soil horizons related to?,"A) The color of the soil, B) The structural layers within the soil profile, C) The temperature of the soil",Answer: B) The structural layers within the soil profile,B,
What process describes the downward movement of rainfall through the soil?,"A) Infiltration, B) Evaporation, C) Transpiration",Answer: A) Infiltration,A,
Which type of soil typically has higher water retention characteristics?,"A) Sandy soil, B) Clay soil, C) Gravelly soil",Answer: B) Clay soil,B,
"What does the term ""field capacity"" refer to in hydrology?","A) The amount of water that drains through the soil, B) The maximum amount of water a soil can hold against gravity, C) The total volume of soil in a given area",Answer: B) The maximum amount of water a soil can hold against gravity,B,
What is the significance of soil moisture tension in agricultural practices?,"A) It determines soil color., B) It indicates the amount of water available to plants., C) It measures soil temperature.",Answer: B) It indicates the amount of water available to plants.,B,
What effect does organic matter have on soil properties?,"A) It decreases soil porosity., B) It improves water retention and infiltration., C) It has no significant effect on soil properties.",Answer: B) It improves water retention and infiltration.,B,
What is the main force driving the process of infiltration?,"A) Capillary action, B) Gravity, C) Soil temperature",Answer: B) Gravity,B,
How does soil structure influence water movement?,"A) It has no effect on water movement., B) It determines the pathways and speed of water flow., C) It only influences the temperature of the soil.",Answer: B) It determines the pathways and speed of water flow.,B,
"What does the concept of ""macropores"" refer to in soil science?","A) Very small pores that retain water, B) Larger pores that facilitate rapid water movement, C) The overall density of soil",Answer: B) Larger pores that facilitate rapid water movement,B,
What is the primary purpose of measuring soil moisture content?,"A) To assess soil color, B) To determine the soil's capacity to support plant growth, C) To evaluate soil temperature variations",Answer: B) To determine the soil's capacity to support plant growth,B,
What is the wilting point in soil moisture terms?,"A) The point at which plants begin to thrive, B) The moisture level at which plants start to wilt, C) The maximum moisture level in the soil",Answer: B) The moisture level at which plants start to wilt,B,
Which term describes the process of water being drawn from the soil to the atmosphere?,"A) Infiltration, B) Exfiltration, C) Evaporation",Answer: B) Exfiltration,B,
What is the relationship between soil texture and plant available water?,"A) Coarse textures have the highest plant available water., B) Intermediate grain sizes generally provide the highest plant available water., C) Soil texture has no impact on plant available water.",Answer: B) Intermediate grain sizes generally provide the highest plant available water.,B,
"What does ""hydraulic conductivity"" refer to in soil science?","A) The ability of soil to hold water, B) The ability of soil to conduct water through its profile, C) The density of soil particles",Answer: B) The ability of soil to conduct water through its profile,B,
